{
  "$schema": "https://json-schema.org/draft/2020-12/schema",
  "$id": "https://github.com/xamalow/HackNationColibri/contracts/owner-alert.schema.json",
  "title": "Sauti owner alert",
  "description": "A notification TO the owner (Noor): a booking arrived, a visitor wrote, a call was missed, a proposal is waiting. It informs; it acts on nobody's behalf, so it carries no approval and is never an action envelope. Facts in text come from code (date, party size, platform), never from a model or a translation. Delivery state (SMS sent, call placed) is kept beside the alert, never inside it: the alert is immutable and its digest proves it. Revision 1.1.0 (new in r1.1).",
  "type": "object",
  "additionalProperties": false,
  "required": [
    "schema",
    "schema_version",
    "alert_id",
    "tenant_id",
    "kind",
    "about",
    "created_at",
    "text",
    "text_language",
    "clip_keys",
    "digest"
  ],
  "properties": {
    "schema": {
      "const": "sauti.owner_alert"
    },
    "schema_version": {
      "const": "1.1.0"
    },
    "alert_id": {
      "$ref": "#/$defs/uuid"
    },
    "tenant_id": {
      "type": "string",
      "minLength": 1,
      "maxLength": 64,
      "pattern": "^[A-Za-z0-9._-]+$"
    },
    "kind": {
      "enum": [
        "booking_received",
        "booking_cancelled",
        "visitor_message",
        "voicemail",
        "missed_call",
        "proposal_waiting"
      ]
    },
    "about": {
      "type": "object",
      "additionalProperties": false,
      "minProperties": 1,
      "properties": {
        "booking_id": {
          "type": "string",
          "minLength": 1,
          "maxLength": 128
        },
        "event_id": {
          "type": "string",
          "minLength": 1,
          "maxLength": 128,
          "description": "The hub intake event (call, SMS, e-mail) this alert reports."
        },
        "action_id": {
          "$ref": "#/$defs/uuid",
          "description": "For proposal_waiting: the envelope Noor may approve. Naming it here grants nothing; approval still needs its own record."
        }
      }
    },
    "created_at": {
      "$ref": "#/$defs/timestamp"
    },
    "text": {
      "type": "string",
      "minLength": 1,
      "maxLength": 600,
      "description": "Exactly what the owner's SMS says. Code-generated from facts."
    },
    "text_language": {
      "type": "string",
      "pattern": "^[a-z]{2,3}(-[A-Za-z0-9]{2,8})*$"
    },
    "clip_keys": {
      "type": "array",
      "maxItems": 20,
      "uniqueItems": true,
      "items": {
        "type": "string",
        "minLength": 1,
        "maxLength": 64,
        "pattern": "^[a-z0-9][a-z0-9._-]*$"
      },
      "description": "Clips the alert call plays, in order; empty when there is no call."
    },
    "digest": {
      "$ref": "#/$defs/sha256",
      "description": "sha256 over 'sauti.owner_alert.v1' + 0x00 + RFC 8785 canonical JSON of this object without the digest member."
    }
  },
  "$defs": {
    "uuid": {
      "type": "string",
      "pattern": "^[0-9a-f]{8}-[0-9a-f]{4}-[1-8][0-9a-f]{3}-[89ab][0-9a-f]{3}-[0-9a-f]{12}$"
    },
    "sha256": {
      "type": "string",
      "pattern": "^[0-9a-f]{64}$"
    },
    "timestamp": {
      "type": "string",
      "pattern": "^[0-9]{4}-(0[1-9]|1[0-2])-(0[1-9]|[12][0-9]|3[01])T([01][0-9]|2[0-3]):[0-5][0-9]:[0-5][0-9]Z$"
    }
  }
}
